{
  "Season Architecture Document": {
    "session_id": "session_20251023_112749",
    "timestamp": "2025-10-23T15:05:17.240345",
    "working_title": "The Accidental Lifeline",
    "primary_genre": "Drama",
    "target_age": "28-55",
    "episode_count": "8-12 episodes",
    "episode_length": "35-45 min each",
    "narrator_strategy": "With Narrator",
    "season_structure_document": {
      "style_recommendations": [
        {
          "style_name": "Wrong-Man Thriller",
          "justification": "This style fits perfectly for a drama targeting adults 28-55, as it creates immediate tension and stakes that mature audiences appreciate. The 'wrong man' scenario provides a strong narrative drive through a protagonist's fight to clear their name, offering both emotional depth and suspense. The balanced tone requirement is met as this style allows for moments of introspection amidst high-stakes action. The narrator strategy works well here, as the narrator can provide insight into the protagonist's internal struggle while maintaining the external tension.",
          "audio_application": "For audio production, this style benefits from distinctive pursuit rhythms - heartbeats, footsteps, and traffic sounds that build tension. The soundscape should shift between paranoid moments (close-mic'd breathing, distorted background sounds) and moments of clarity (clean audio, minimal ambient noise). The narrator's voice can be used to bridge scenes, with tonal shifts indicating the protagonist's changing emotional state. Key moments of accusation or discovery can be punctuated with sudden silence or sharp audio cues.",
          "structure_implications": "This style naturally creates a four-act structure: Act 1 establishes the protagonist's ordinary life and the initial accusation; Act 2 follows their flight and initial investigation; Act 3 intensifies as the protagonist closes in on the truth while evading capture; Act 4 resolves with the exposure of the real culprit and the protagonist's exoneration. Each episode can balance forward momentum with character development, with cliffhangers typically involving new accusations, close calls with authorities, or shocking discoveries that complicate the protagonist's understanding of the frame job.",
          "demo_script": "[SOUND: City traffic, distant sirens]\n\nNARRATOR: Thomas Merrick had been having one of those days. The kind where nothing goes quite right, but nothing goes terribly wrong either. Until now.\n\nTHOMAS: (Breathing heavily) I don't understand. What are you talking about?\n\n[SOUND: Chair scraping, two sets of footsteps approaching]\n\nDETECTIVE MILLER: Thomas Merrick, you're under arrest for the murder of James Worthington.\n\nTHOMAS: What? That's impossible! I haven't seen James in months!\n\n[SOUND: Handcuffs clicking]\n\nDETECTIVE MILLER: Tell it to the judge. We have your fingerprints on the weapon.\n\nTHOMAS: That's not possible! I was at the office all day yesterday. Ask anyone!\n\n[SOUND: Door opening, footsteps]\n\nNARRATOR: The interrogation room was cold, sterile. Thomas sat alone, the echo of the detective's words ringing in his ears. James Worthington was dead, and somehow, he was the prime suspect.\n\nTHOMAS: (Whispering to himself) James... dead? But why would someone want to frame me?\n\n[SOUND: Flashback effect - muffled voices, distorted]\n\nJAMES (FROM MEMORY): Tom, you need to be careful what you sign. That contract... there are things you don't know.\n\nTHOMAS (FROM MEMORY): It's just a standard merger agreement. What could possibly be wrong with it?\n\nJAMES (FROM MEMORY): Some people stand to lose a lot more than money if this goes through. People who don't play by the rules.\n\n[SOUND: Return to present]\n\nNARRATOR: The memory snapped into focus with horrifying clarity. The merger. The opposition. The millions at stake. Suddenly, Thomas wasn't just fighting for his freedom â€“ he was fighting for his life.\n\n[SOUND: Door opening]\n\nDETECTIVE MILLER: Ready to talk, Merrick?\n\nTHOMAS: (Voice firm now) I didn't kill James. But I think I know who might have.\n\n[SOUND: Tense music swells]\n\nNARRATOR: In that moment, Thomas Merrick became a fugitive. Not from justice, but from a truth someone was willing to kill to keep buried."
        },
        {
          "style_name": "Investigation Duel",
          "justification": "This style works exceptionally well for the target audience (28-55) who appreciate complex narratives and moral ambiguity. The dual-perspective approach adds depth to the drama, allowing listeners to engage with multiple viewpoints and piece together the truth themselves. It supports the balanced tone requirement by alternating between tension-filled moments and character-driven scenes. The narrator strategy enhances this style, as the narrator can seamlessly transition between perspectives while maintaining narrative cohesion.",
          "audio_application": "Audio production for this style should feature distinctive acoustic signatures for each perspective - perhaps different ambient backgrounds or subtle audio filters. Overlapping voice techniques can be used when characters' investigations converge. The narrator's voice can serve as the bridge between perspectives, with subtle shifts in tone or pacing to signal transitions. Key moments of discovery can be enhanced with synchronized audio cues that play across both perspectives, emphasizing the interconnected nature of their investigations.",
          "structure_implications": "This style creates a natural alternating structure between the two perspectives, with episodes or segments within episodes dedicated to each investigator. The season can be structured around key discovery points where the investigations intersect or diverge. Act 1 establishes both investigators and their connection to the case; Act 2 follows their separate investigations; Act 3 brings them into direct conflict or collaboration; Act 4 resolves the mystery and their relationship to each other. Cliffhangers often involve one investigator discovering something that the audience knows would change everything for the other, creating dramatic irony.",
          "demo_script": "[SOUND: Rain on window, distant thunder]\n\nNARRATOR: In the city that never sleeps, two investigations were about to collide. Detective Sarah Chen stood in her apartment, reviewing case files. Across town, journalist Marcus Reed prepared to publish a story that could destroy everything.\n\nSARAH: (Muttering to herself) The evidence doesn't add up. The timeline, the motive... none of it makes sense.\n\n[SOUND: Papers shuffling]\n\nNARRATOR: Sarah had been with the force for fifteen years, but this case felt different. The victim was a prominent businessman with connections to everyone who mattered in the city.\n\nSARAH: (Picking up phone) Miller, it's Chen. I need you to pull the financial records again. There's something I'm missing.\n\n[SOUND: Phone dialing, ringing]\n\nMARCUS: (Voicemail) This is Marcus Reed. If you're calling about the Worthington story, you're too late. The truth is coming out tomorrow.\n\n[SOUND: Hang up, typing]\n\nNARRATOR: Marcus Reed had been working the Worthington case for months, following a trail of corruption that led to the highest levels of city government. He didn't know that Detective Chen was following a similar trail from a different starting point.\n\nMARCUS: (To himself) If this story breaks, everything changes. But am I ready for what comes next?\n\n[SOUND: Email notification]\n\nMARCUS: What's this? An anonymous tip? 'Check the offshore accounts in the victim's wife's name.'\n\n[SOUND: Keyboard typing]\n\nNARRATOR: While Marcus followed the digital trail, Sarah was following a more traditional one, knocking on doors and asking questions that made powerful people nervous.\n\nSARAH: (Voice recording) Interview with Mrs. Worthington. Claims to have no knowledge of her husband's business dealings. Body language suggests deception.\n\n[SOUND: Doorbell ringing]\n\nSARAH: Detective Chen. I have a few more questions.\n\nMRS. WORTHINGTON: (Nervous) I've already told you everything I know.\n\nNARRATOR: In that moment, both Sarah and Marcus were closing in on the same truth from different directions. Neither realized how dangerous that truth would prove to be.\n\n[SOUND: Car door closing, engine starting]\n\nSARAH: Something's not right about her story. I need to dig deeper.\n\n[SOUND: Phone ringing]\n\nMARCUS: Reed. What do you mean someone's asking about my sources? No, I never reveal my sources. Ever.\n\n[SOUND: Line disconnecting, tense music]\n\nNARRATOR: Two investigators, one truth, and powerful people who would do anything to keep it buried. The investigation duel had begun."
        },
        {
          "style_name": "Mystery-Box Structure",
          "justification": "This style is ideal for the target audience (28-55) who enjoy complex narratives that reward active listening and intellectual engagement. The mystery-box approach creates sustained intrigue by revealing questions faster than answers, perfect for a drama that wants to maintain listener investment across 8-12 episodes. The balanced tone is maintained through the rhythm of revelation and mystery, with moments of clarity amidst the confusion. The narrator strategy enhances this style, as the narrator can pose questions, provide context, and emphasize the significance of revelations without giving away too much.",
          "audio_application": "Audio production for this style should employ a 'curiosity cadence' - musical cues and sound design that build tension around unanswered questions. The narrator's delivery can include subtle question-mark intonations when highlighting mysteries. Each revelation should be punctuated with a distinctive audio signature that signals its importance to the overall puzzle. Environmental sounds can contain hidden clues for attentive listeners, rewarding repeat listens. The soundscape should evolve as the mystery deepens, becoming more complex and layered.",
          "structure_implications": "This style creates a structure based on revelation rather than traditional acts. Each episode introduces new questions while partially answering old ones, creating a nested mystery structure. The season can be organized around major revelation points, with episodes leading up to and following these key moments. Early episodes establish the central mystery and several related sub-mysteries; middle episodes deepen the complexity while providing just enough answers to maintain engagement; later episodes begin tying threads together; the final episode provides resolution while potentially introducing one final mystery. Cliffhangers typically involve shocking revelations that reframe everything the audience (and characters) thought they knew.",
          "demo_script": "[SOUND: Gentle piano music, rain sounds]\n\nNARRATOR: Every story begins with a question. This one begins with several. Who was the man in the brown coat? Why did he visit three different people on the day he died? And what was in the envelope he left behind?\n\nDR. ELIZABETH WINTERS: (Examining a file) The tox screen came back negative. No poisons, no drugs. Nothing.\n\n[SOUND: Paper rustling]\n\nNARRATOR: Dr. Elizabeth Winters had been the city medical examiner for twelve years. She'd seen thousands of deaths, but this one was different. No apparent cause. No witnesses. No clues. Just a man lying peacefully in a park, as if he'd simply decided to stop living.\n\nDR. WINTERS: (To herself) Who are you, John Doe? And what killed you?\n\n[SOUND: Phone ringing]\n\nDET. RIVERA: Winters. What have you got for me?\n\nDR. WINTERS: Nothing, Rivera. Absolutely nothing.\n\nDET. RIVERA: That's impossible. Everyone has something.\n\n[SOUND: Door opening]\n\nNARRATOR: Meanwhile, across town, a young woman named Maya Chen was discovering that her recently deceased father had been living a double life.\n\nMAYA: (Whispering) Dad... who were you really?\n\n[SOUND: Drawer opening, envelope being removed]\n\nNARRATOR: The envelope contained a single key and a note with an address. No explanation. No context. Just another piece of a puzzle that was becoming more complex by the minute.\n\nMAYA: (To herself) What were you involved in? And why didn't you trust me enough to tell me?\n\n[SOUND: Car starting, driving]\n\nNARRATOR: As Maya drove to the address on the note, Detective Rivera was making a discovery of his own.\n\nDET. RIVERA: (Voice recording) Victim's fingerprints match those from a cold case file from ten years ago. But that's impossible. The man in that case was confirmed dead.\n\n[SOUND: Tense music swelling]\n\nNARRATOR: Three people. Three mysteries. One connection they didn't yet know they shared. The question wasn't just who died, but who lived. And why.\n\n[SOUND: Door opening, footsteps]\n\nMAYA: Hello? Is anyone here?\n\n[SOUND: Muffled voice, distorted]\n\nUNKNOWN VOICE: We've been expecting you, Ms. Chen. Your father told us you'd come.\n\n[SOUND: Music crescendo]\n\nNARRATOR: Every answer, it seemed, only led to more questions. And the biggest question of all was just beginning to emerge: What was the Accidental Lifeline?"
        }
      ],
      "season_skeleton": {
        "macro_structure": {
          "act_1": "Episodes 1-3",
          "act_2": "Episodes 4-6",
          "act_3": "Episodes 7-9",
          "act_4": "Episodes 10-12"
        },
        "episode_grid": [
          {
            "episode_number": 1,
            "primary_function": "Setup",
            "energy_level": 7,
            "subplot_focus": "Protagonist Introduction",
            "cliffhanger_type": "Revelation"
          },
          {
            "episode_number": 2,
            "primary_function": "Complication",
            "energy_level": 8,
            "subplot_focus": "False Accusation",
            "cliffhanger_type": "Peril"
          },
          {
            "episode_number": 3,
            "primary_function": "Rising Action",
            "energy_level": 9,
            "subplot_focus": "Initial Investigation",
            "cliffhanger_type": "Discovery"
          },
          {
            "episode_number": 4,
            "primary_function": "Rising Action",
            "energy_level": 8,
            "subplot_focus": "First Ally",
            "cliffhanger_type": "Revelation"
          },
          {
            "episode_number": 5,
            "primary_function": "Rising Action",
            "energy_level": 7,
            "subplot_focus": "Personal Stakes",
            "cliffhanger_type": "Betrayal"
          },
          {
            "episode_number": 6,
            "primary_function": "Midpoint",
            "energy_level": 10,
            "subplot_focus": "Major Revelation",
            "cliffhanger_type": "Twist"
          },
          {
            "episode_number": 7,
            "primary_function": "Falling Action",
            "energy_level": 9,
            "subplot_focus": "New Strategy",
            "cliffhanger_type": "Setback"
          },
          {
            "episode_number": 8,
            "primary_function": "Falling Action",
            "energy_level": 8,
            "subplot_focus": "Hidden Connection",
            "cliffhanger_type": "Peril"
          },
          {
            "episode_number": 9,
            "primary_function": "Falling Action",
            "energy_level": 9,
            "subplot_focus": "Confrontation",
            "cliffhanger_type": "Revelation"
          },
          {
            "episode_number": 10,
            "primary_function": "Climax",
            "energy_level": 10,
            "subplot_focus": "Truth Revealed",
            "cliffhanger_type": "Crisis"
          },
          {
            "episode_number": 11,
            "primary_function": "Resolution",
            "energy_level": 8,
            "subplot_focus": "Aftermath",
            "cliffhanger_type": "Decision"
          },
          {
            "episode_number": 12,
            "primary_function": "Conclusion",
            "energy_level": 6,
            "subplot_focus": "New Beginning",
            "cliffhanger_type": "None"
          }
        ]
      },
      "rhythm_mapping": {
        "tension_peaks": [
          3,
          6,
          9,
          10
        ],
        "breathing_room": [
          5,
          8,
          11
        ],
        "format_breaks": [
          4,
          7,
          12
        ],
        "revelation_cascade": [
          3,
          6,
          9,
          10,
          11
        ]
      }
    },
    "readable_summary": "======================================================================\nSTATION 5: SEASON ARCHITECT\n======================================================================\n\nWorking Title: The Accidental Lifeline\nPrimary Genre: Drama\nTarget Age: 28-55\nEpisode Count: 8-12 episodes\nEpisode Length: 35-45 min each\nNarrator Strategy: With Narrator\n\n----------------------------------------------------------------------\nSTYLE RECOMMENDATIONS\n----------------------------------------------------------------------\n\n1. Wrong-Man Thriller\n   Justification: This style fits perfectly for a drama targeting adults 28-55, as it creates immediate tension and stakes that mature audiences appreciate. The 'wrong man' scenario provides a strong narrative drive through a protagonist's fight to clear their name, offering both emotional depth and suspense. The balanced tone requirement is met as this style allows for moments of introspection amidst high-stakes action. The narrator strategy works well here, as the narrator can provide insight into the protagonist's internal struggle while maintaining the external tension.\n   Audio Application: For audio production, this style benefits from distinctive pursuit rhythms - heartbeats, footsteps, and traffic sounds that build tension. The soundscape should shift between paranoid moments (close-mic'd breathing, distorted background sounds) and moments of clarity (clean audio, minimal ambient noise). The narrator's voice can be used to bridge scenes, with tonal shifts indicating the protagonist's changing emotional state. Key moments of accusation or discovery can be punctuated with sudden silence or sharp audio cues.\n   Structure Implications: This style naturally creates a four-act structure: Act 1 establishes the protagonist's ordinary life and the initial accusation; Act 2 follows their flight and initial investigation; Act 3 intensifies as the protagonist closes in on the truth while evading capture; Act 4 resolves with the exposure of the real culprit and the protagonist's exoneration. Each episode can balance forward momentum with character development, with cliffhangers typically involving new accusations, close calls with authorities, or shocking discoveries that complicate the protagonist's understanding of the frame job.\n\n2. Investigation Duel\n   Justification: This style works exceptionally well for the target audience (28-55) who appreciate complex narratives and moral ambiguity. The dual-perspective approach adds depth to the drama, allowing listeners to engage with multiple viewpoints and piece together the truth themselves. It supports the balanced tone requirement by alternating between tension-filled moments and character-driven scenes. The narrator strategy enhances this style, as the narrator can seamlessly transition between perspectives while maintaining narrative cohesion.\n   Audio Application: Audio production for this style should feature distinctive acoustic signatures for each perspective - perhaps different ambient backgrounds or subtle audio filters. Overlapping voice techniques can be used when characters' investigations converge. The narrator's voice can serve as the bridge between perspectives, with subtle shifts in tone or pacing to signal transitions. Key moments of discovery can be enhanced with synchronized audio cues that play across both perspectives, emphasizing the interconnected nature of their investigations.\n   Structure Implications: This style creates a natural alternating structure between the two perspectives, with episodes or segments within episodes dedicated to each investigator. The season can be structured around key discovery points where the investigations intersect or diverge. Act 1 establishes both investigators and their connection to the case; Act 2 follows their separate investigations; Act 3 brings them into direct conflict or collaboration; Act 4 resolves the mystery and their relationship to each other. Cliffhangers often involve one investigator discovering something that the audience knows would change everything for the other, creating dramatic irony.\n\n3. Mystery-Box Structure\n   Justification: This style is ideal for the target audience (28-55) who enjoy complex narratives that reward active listening and intellectual engagement. The mystery-box approach creates sustained intrigue by revealing questions faster than answers, perfect for a drama that wants to maintain listener investment across 8-12 episodes. The balanced tone is maintained through the rhythm of revelation and mystery, with moments of clarity amidst the confusion. The narrator strategy enhances this style, as the narrator can pose questions, provide context, and emphasize the significance of revelations without giving away too much.\n   Audio Application: Audio production for this style should employ a 'curiosity cadence' - musical cues and sound design that build tension around unanswered questions. The narrator's delivery can include subtle question-mark intonations when highlighting mysteries. Each revelation should be punctuated with a distinctive audio signature that signals its importance to the overall puzzle. Environmental sounds can contain hidden clues for attentive listeners, rewarding repeat listens. The soundscape should evolve as the mystery deepens, becoming more complex and layered.\n   Structure Implications: This style creates a structure based on revelation rather than traditional acts. Each episode introduces new questions while partially answering old ones, creating a nested mystery structure. The season can be organized around major revelation points, with episodes leading up to and following these key moments. Early episodes establish the central mystery and several related sub-mysteries; middle episodes deepen the complexity while providing just enough answers to maintain engagement; later episodes begin tying threads together; the final episode provides resolution while potentially introducing one final mystery. Cliffhangers typically involve shocking revelations that reframe everything the audience (and characters) thought they knew.\n\n----------------------------------------------------------------------\nSEASON SKELETON\n----------------------------------------------------------------------\n\nMACRO STRUCTURE:\n  act_1: Episodes 1-3\n  act_2: Episodes 4-6\n  act_3: Episodes 7-9\n  act_4: Episodes 10-12\n\nEPISODE GRID:\n  Episode 1: Setup (Energy: 7, Subplot: Protagonist Introduction, Cliffhanger: Revelation)\n  Episode 2: Complication (Energy: 8, Subplot: False Accusation, Cliffhanger: Peril)\n  Episode 3: Rising Action (Energy: 9, Subplot: Initial Investigation, Cliffhanger: Discovery)\n  Episode 4: Rising Action (Energy: 8, Subplot: First Ally, Cliffhanger: Revelation)\n  Episode 5: Rising Action (Energy: 7, Subplot: Personal Stakes, Cliffhanger: Betrayal)\n  Episode 6: Midpoint (Energy: 10, Subplot: Major Revelation, Cliffhanger: Twist)\n  Episode 7: Falling Action (Energy: 9, Subplot: New Strategy, Cliffhanger: Setback)\n  Episode 8: Falling Action (Energy: 8, Subplot: Hidden Connection, Cliffhanger: Peril)\n  Episode 9: Falling Action (Energy: 9, Subplot: Confrontation, Cliffhanger: Revelation)\n  Episode 10: Climax (Energy: 10, Subplot: Truth Revealed, Cliffhanger: Crisis)\n  ... and 2 more episodes\n\n----------------------------------------------------------------------\nRHYTHM MAPPING\n----------------------------------------------------------------------\n\nTension Peaks: Episodes 3, 6, 9, 10\nBreathing Room: Episodes 5, 8, 11\nFormat Breaks: Episodes 4, 7, 12\nRevelation Cascade: Episodes 3, 6, 9, 10, 11\n\n======================================================================\nEND OF SEASON ARCHITECTURE\n======================================================================"
  }
}