{
  "Season Architecture Document": {
    "session_id": "session_20251021_204431",
    "timestamp": "2025-10-21T21:06:51.847258",
    "working_title": "The Lifeline Text",
    "primary_genre": "Contemporary Romance",
    "target_age": "28-50",
    "episode_count": "8-12 episodes",
    "episode_length": "35-45 min each",
    "narrator_strategy": "Hybrid Approach",
    "season_structure_document": {
      "style_recommendations": [
        {
          "style_name": "Romance Engine",
          "justification": "This style is perfectly suited for a Contemporary Romance audiobook as it follows the natural progression of romantic relationships: meeting, developing connection, conflict, and resolution. The structure allows for the gradual tone shift required by the project, starting with more dark moments (3:1 ratio) when the relationship is fragile and potentially falling apart, then transitioning to more light moments (1:3 ratio) as the relationship strengthens and resolves. The target audience of 28-50 year olds will appreciate the mature emotional journey this structure provides.",
          "audio_application": "For the 'Meet' phase, use audio techniques that create distance and uncertainty - reverb, minor key themes, and restrained voice performances. During the 'Fun' phase, gradually introduce closer microphone techniques and more expressive voice performances. The 'Fall Apart' phase will maximize the dark audio elements while still including brief 'glimmers' of hope through subtle musical elements. The 'Grand Gesture' and 'Resolution' phases will predominantly use light audio techniques while maintaining subtle acknowledgments of the characters' ongoing mental health challenges.",
          "structure_implications": "The Romance Engine naturally divides into 5 phases that can be distributed across 8-12 episodes. Act 1 (Episodes 1-2) covers the 'Meet' phase. Act 2 (Episodes 3-6) covers the 'Fun' phase where the relationship develops. Act 3 (Episodes 7-9) covers the 'Fall Apart' phase where conflicts arise. Act 4 (Episodes 10-12) covers the 'Grand Gesture' and 'Resolution' phases. This structure allows for the gradual shift in tone ratio from dark to light as specified in the project requirements.",
          "demo_script": "[OPENING with distant, slightly distorted audio - minor key piano underneath] NARRATOR: Sarah hadn't expected the text message to change everything. It was just words on a screen, yet they carried the weight of a life raft in stormy seas. [SFX: Phone notification sound, slightly muted] SARAH (voice restrained, distant): 'I saw your article. I've been there too.' [Music shifts slightly - a hint of warmth in the piano] SARAH (slightly closer mic): Who was this stranger who understood the darkness she'd never spoken of? [CUT TO: Two weeks later - closer microphone technique, brighter music] SARAH (more expressive): Coffee with Michael felt like coming home to a place she'd never been. His laugh was unexpected, genuine. [SFX: Coffee shop ambiance, closer and clearer] MICHAEL (warm voice): 'Your writing gave voice to things I thought were just mine.' [Music swells with major key elements] SARAH (voice full of hope): For the first time in years, the silence in her mind wasn't empty. It was peaceful. [SFX: Gentle rain sounds begin] NARRATOR: But peace is fragile, and storms return. [Music shifts back to minor key, reverb increases] SARAH (voice becoming distant again): The message from Michael was short. 'I can't do this.' And just like that, the lifeline was cut. [FAINT major key melody plays briefly underneath - the 'glimmer'] SARAH: Or was it?"
        },
        {
          "style_name": "Rise→Fall→Redemption Arc",
          "justification": "This structure works well for the target age group (28-50) who will appreciate a mature emotional journey with significant stakes. The arc naturally accommodates the required tone shift from dark to light moments throughout the season. It's particularly effective for exploring mental health themes within a romance, as it shows characters achieving success, experiencing setbacks, and ultimately finding redemption through growth and self-acceptance. This structure also complements the hybrid narrator approach, allowing for both character perspectives and an omniscient narrator to guide listeners through the emotional peaks and valleys.",
          "audio_application": "During the 'Rise' phase, begin with darker audio techniques (reverb, minor keys, restrained performances) that gradually lighten as the relationship develops. The 'Fall' phase will maximize these dark techniques while still incorporating subtle 'glimmers' of hope through brief musical elements. The 'Redemption' phase will predominantly use lighter audio techniques (close microphone, major keys, expressive performances) while maintaining subtle textures that acknowledge the ongoing reality of mental health challenges. The motif evolution throughout the arc will provide auditory signposts of the characters' journey.",
          "structure_implications": "This arc naturally divides into three main phases that can be distributed across 8-12 episodes. Act 1 (Episodes 1-3) covers the 'Rise' - meeting and developing the relationship. Act 2 (Episodes 4-8) covers the 'Fall' - the emergence of conflicts and the relationship's breakdown. Act 3 (Episodes 9-12) covers the 'Redemption' - personal growth and reconciliation. This structure allows for the gradual tone shift from a 3:1 dark-to-light ratio in early episodes to a 1:3 ratio in the conclusion, as specified in the project requirements.",
          "demo_script": "[OPENING with minor key music, moderate reverb] NARRATOR: When Sarah published her article about mental health, she never expected it to become her lifeline. SARAH (voice restrained, distant): 'Putting those words into the world felt like jumping off a cliff.' [SFX: Keyboard typing, distant] NARRATOR: But the response was immediate. [SFX: Phone notification sounds, gradually getting closer] MICHAEL (voice with slight echo): 'I read what you wrote. I've been looking for words like that my whole life.' [Music shifts slightly - a major chord introduced] SARAH (voice slightly closer): Their coffee date felt like the first deep breath after years of holding it in. [SFX: Coffee shop ambiance, clearer and closer] MICHAEL (warmer voice): 'It's like you've been living in my head.' SARAH (more expressive): For months, they built something fragile and beautiful. [Brighter music, closer microphone technique] SARAH: 'I never thought I'd find someone who understands.' [Music suddenly shifts back to minor key, reverb increases] NARRATOR: But understanding doesn't erase the past. MICHAEL (voice becoming distant): 'I can't be your salvation, Sarah. I'm barely keeping myself afloat.' [FAINT major key melody plays briefly underneath] SARAH: Maybe they weren't each other's lifelines. Maybe they were just two people learning to swim."
        },
        {
          "style_name": "Family Thread Structure",
          "justification": "This style is well-suited for a Contemporary Romance targeting 28-50 year olds as it focuses on domestic stakes and quiet drama that resonates with adult listeners. The structure allows for deep exploration of how mental health challenges impact not just the central relationship but also family dynamics, which adds depth and authenticity to the narrative. The gradual tone shift from dark to light moments can be effectively portrayed through evolving family interactions and household dynamics, making the emotional journey feel grounded and relatable.",
          "audio_application": "In early episodes, use household sounds (kitchen ambiance, door creaks, etc.) with darker audio treatments - reverb, minor key themes, and restrained voice performances - to create a sense of emotional distance within the home environment. As the tone shifts, these same household sounds will be treated with brighter audio techniques - closer microphone placement, major key musical elements, and more expressive voice performances - to reflect improving family dynamics and mental health. Even in the lightest moments, subtle audio textures will acknowledge the ongoing reality of mental health challenges.",
          "structure_implications": "The Family Thread Structure allows for 8-12 episodes that explore how the central romance impacts and is impacted by family relationships. Act 1 (Episodes 1-3) introduces the characters and their family contexts. Act 2 (Episodes 4-6) develops the romance alongside family dynamics. Act 3 (Episodes 7-9) explores how family pressures contribute to relationship challenges. Act 4 (Episodes 10-12) shows resolution and healing within both the romantic relationship and family structures. This structure naturally accommodates the required tone shift from dark to light moments throughout the season.",
          "demo_script": "[OPENING with kitchen sounds - coffee brewing, dishes being washed - treated with reverb and minor key music] SARAH (voice restrained, distant): 'Morning, Mom.' [SFX: Faint sound of newspaper rustling] MOTHER (distant voice): 'Did you take your medication?' SARAH: 'Yes.' [Pause] 'I'm seeing someone today. A friend.' NARRATOR: The word 'friend' felt like a lifeline in the suffocating familiarity of her childhood home. [SFX: Door closes, sound of car starting - music shifts slightly] SARAH (voice slightly closer): Meeting Michael was like stepping into a world where the air was easier to breathe. [SFX: Coffee shop ambiance, clearer and closer] MICHAEL (warm voice): 'Family can be both anchor and storm, can't it?' SARAH (more expressive): 'How did you know?' [Brighter music, closer microphone technique] MICHAEL: 'Because I'm sailing the same ocean.' [SFX: Sound of rain against windows, music shifts back to minor key] NARRATOR: As their connection deepened, so did the complications. SARAH (voice becoming distant): 'My mother doesn't understand. She thinks I'm just being difficult.' [FAINT major key melody plays briefly underneath] MICHAEL: 'Maybe she's afraid of the storm because she doesn't know how to swim either.'"
        }
      ],
      "season_skeleton": {
        "macro_structure": {
          "act_1": "Episodes 1-2",
          "act_2": "Episodes 3-6",
          "act_3": "Episodes 7-9",
          "act_4": "Episodes 10-12"
        },
        "episode_grid": [
          {
            "episode_number": 1,
            "primary_function": "Setup",
            "energy_level": 6,
            "subplot_focus": "Character Introduction",
            "cliffhanger_type": "Revelation"
          },
          {
            "episode_number": 2,
            "primary_function": "Development",
            "energy_level": 7,
            "subplot_focus": "First Contact",
            "cliffhanger_type": "Decision"
          },
          {
            "episode_number": 3,
            "primary_function": "Development",
            "energy_level": 8,
            "subplot_focus": "First Date",
            "cliffhanger_type": "Connection"
          },
          {
            "episode_number": 4,
            "primary_function": "Development",
            "energy_level": 8,
            "subplot_focus": "Deepening Bond",
            "cliffhanger_type": "Vulnerability"
          },
          {
            "episode_number": 5,
            "primary_function": "Development",
            "energy_level": 7,
            "subplot_focus": "Shared Experiences",
            "cliffhanger_type": "Intimacy"
          },
          {
            "episode_number": 6,
            "primary_function": "Complication",
            "energy_level": 6,
            "subplot_focus": "External Pressures",
            "cliffhanger_type": "Conflict"
          },
          {
            "episode_number": 7,
            "primary_function": "Complication",
            "energy_level": 5,
            "subplot_focus": "Misunderstanding",
            "cliffhanger_type": "Separation"
          },
          {
            "episode_number": 8,
            "primary_function": "Complication",
            "energy_level": 4,
            "subplot_focus": "Individual Struggles",
            "cliffhanger_type": "Crisis"
          },
          {
            "episode_number": 9,
            "primary_function": "Crisis",
            "energy_level": 3,
            "subplot_focus": "Low Point",
            "cliffhanger_type": "Revelation"
          },
          {
            "episode_number": 10,
            "primary_function": "Resolution",
            "energy_level": 6,
            "subplot_focus": "Self-Discovery",
            "cliffhanger_type": "Decision"
          },
          {
            "episode_number": 11,
            "primary_function": "Resolution",
            "energy_level": 8,
            "subplot_focus": "Reconciliation",
            "cliffhanger_type": "Hope"
          },
          {
            "episode_number": 12,
            "primary_function": "Climax",
            "energy_level": 9,
            "subplot_focus": "New Beginning",
            "cliffhanger_type": "Resolution"
          }
        ]
      },
      "rhythm_mapping": {
        "tension_peaks": [
          2,
          6,
          9,
          11
        ],
        "breathing_room": [
          4,
          8,
          10
        ],
        "format_breaks": [
          3,
          7,
          12
        ],
        "revelation_cascade": [
          1,
          5,
          9,
          11,
          12
        ]
      }
    },
    "readable_summary": "======================================================================\nSTATION 5: SEASON ARCHITECT\n======================================================================\n\nWorking Title: The Lifeline Text\nPrimary Genre: Contemporary Romance\nTarget Age: 28-50\nEpisode Count: 8-12 episodes\nEpisode Length: 35-45 min each\nNarrator Strategy: Hybrid Approach\n\n----------------------------------------------------------------------\nSTYLE RECOMMENDATIONS\n----------------------------------------------------------------------\n\n1. Romance Engine\n   Justification: This style is perfectly suited for a Contemporary Romance audiobook as it follows the natural progression of romantic relationships: meeting, developing connection, conflict, and resolution. The structure allows for the gradual tone shift required by the project, starting with more dark moments (3:1 ratio) when the relationship is fragile and potentially falling apart, then transitioning to more light moments (1:3 ratio) as the relationship strengthens and resolves. The target audience of 28-50 year olds will appreciate the mature emotional journey this structure provides.\n   Audio Application: For the 'Meet' phase, use audio techniques that create distance and uncertainty - reverb, minor key themes, and restrained voice performances. During the 'Fun' phase, gradually introduce closer microphone techniques and more expressive voice performances. The 'Fall Apart' phase will maximize the dark audio elements while still including brief 'glimmers' of hope through subtle musical elements. The 'Grand Gesture' and 'Resolution' phases will predominantly use light audio techniques while maintaining subtle acknowledgments of the characters' ongoing mental health challenges.\n   Structure Implications: The Romance Engine naturally divides into 5 phases that can be distributed across 8-12 episodes. Act 1 (Episodes 1-2) covers the 'Meet' phase. Act 2 (Episodes 3-6) covers the 'Fun' phase where the relationship develops. Act 3 (Episodes 7-9) covers the 'Fall Apart' phase where conflicts arise. Act 4 (Episodes 10-12) covers the 'Grand Gesture' and 'Resolution' phases. This structure allows for the gradual shift in tone ratio from dark to light as specified in the project requirements.\n\n2. Rise→Fall→Redemption Arc\n   Justification: This structure works well for the target age group (28-50) who will appreciate a mature emotional journey with significant stakes. The arc naturally accommodates the required tone shift from dark to light moments throughout the season. It's particularly effective for exploring mental health themes within a romance, as it shows characters achieving success, experiencing setbacks, and ultimately finding redemption through growth and self-acceptance. This structure also complements the hybrid narrator approach, allowing for both character perspectives and an omniscient narrator to guide listeners through the emotional peaks and valleys.\n   Audio Application: During the 'Rise' phase, begin with darker audio techniques (reverb, minor keys, restrained performances) that gradually lighten as the relationship develops. The 'Fall' phase will maximize these dark techniques while still incorporating subtle 'glimmers' of hope through brief musical elements. The 'Redemption' phase will predominantly use lighter audio techniques (close microphone, major keys, expressive performances) while maintaining subtle textures that acknowledge the ongoing reality of mental health challenges. The motif evolution throughout the arc will provide auditory signposts of the characters' journey.\n   Structure Implications: This arc naturally divides into three main phases that can be distributed across 8-12 episodes. Act 1 (Episodes 1-3) covers the 'Rise' - meeting and developing the relationship. Act 2 (Episodes 4-8) covers the 'Fall' - the emergence of conflicts and the relationship's breakdown. Act 3 (Episodes 9-12) covers the 'Redemption' - personal growth and reconciliation. This structure allows for the gradual tone shift from a 3:1 dark-to-light ratio in early episodes to a 1:3 ratio in the conclusion, as specified in the project requirements.\n\n3. Family Thread Structure\n   Justification: This style is well-suited for a Contemporary Romance targeting 28-50 year olds as it focuses on domestic stakes and quiet drama that resonates with adult listeners. The structure allows for deep exploration of how mental health challenges impact not just the central relationship but also family dynamics, which adds depth and authenticity to the narrative. The gradual tone shift from dark to light moments can be effectively portrayed through evolving family interactions and household dynamics, making the emotional journey feel grounded and relatable.\n   Audio Application: In early episodes, use household sounds (kitchen ambiance, door creaks, etc.) with darker audio treatments - reverb, minor key themes, and restrained voice performances - to create a sense of emotional distance within the home environment. As the tone shifts, these same household sounds will be treated with brighter audio techniques - closer microphone placement, major key musical elements, and more expressive voice performances - to reflect improving family dynamics and mental health. Even in the lightest moments, subtle audio textures will acknowledge the ongoing reality of mental health challenges.\n   Structure Implications: The Family Thread Structure allows for 8-12 episodes that explore how the central romance impacts and is impacted by family relationships. Act 1 (Episodes 1-3) introduces the characters and their family contexts. Act 2 (Episodes 4-6) develops the romance alongside family dynamics. Act 3 (Episodes 7-9) explores how family pressures contribute to relationship challenges. Act 4 (Episodes 10-12) shows resolution and healing within both the romantic relationship and family structures. This structure naturally accommodates the required tone shift from dark to light moments throughout the season.\n\n----------------------------------------------------------------------\nSEASON SKELETON\n----------------------------------------------------------------------\n\nMACRO STRUCTURE:\n  act_1: Episodes 1-2\n  act_2: Episodes 3-6\n  act_3: Episodes 7-9\n  act_4: Episodes 10-12\n\nEPISODE GRID:\n  Episode 1: Setup (Energy: 6, Subplot: Character Introduction, Cliffhanger: Revelation)\n  Episode 2: Development (Energy: 7, Subplot: First Contact, Cliffhanger: Decision)\n  Episode 3: Development (Energy: 8, Subplot: First Date, Cliffhanger: Connection)\n  Episode 4: Development (Energy: 8, Subplot: Deepening Bond, Cliffhanger: Vulnerability)\n  Episode 5: Development (Energy: 7, Subplot: Shared Experiences, Cliffhanger: Intimacy)\n  Episode 6: Complication (Energy: 6, Subplot: External Pressures, Cliffhanger: Conflict)\n  Episode 7: Complication (Energy: 5, Subplot: Misunderstanding, Cliffhanger: Separation)\n  Episode 8: Complication (Energy: 4, Subplot: Individual Struggles, Cliffhanger: Crisis)\n  Episode 9: Crisis (Energy: 3, Subplot: Low Point, Cliffhanger: Revelation)\n  Episode 10: Resolution (Energy: 6, Subplot: Self-Discovery, Cliffhanger: Decision)\n  ... and 2 more episodes\n\n----------------------------------------------------------------------\nRHYTHM MAPPING\n----------------------------------------------------------------------\n\nTension Peaks: Episodes 2, 6, 9, 11\nBreathing Room: Episodes 4, 8, 10\nFormat Breaks: Episodes 3, 7, 12\nRevelation Cascade: Episodes 1, 5, 9, 11, 12\n\n======================================================================\nEND OF SEASON ARCHITECTURE\n======================================================================"
  }
}