{
  "Season Architecture Document": {
    "session_id": "session_20251017_142930",
    "timestamp": "2025-10-17T14:55:44.077450",
    "working_title": "Wrong Number, Right Message",
    "primary_genre": "Contemporary Romance",
    "target_age": "25-55",
    "episode_count": "8-12 episodes",
    "episode_length": "35-45 min each",
    "narrator_strategy": "With Narrator",
    "season_structure_document": {
      "style_recommendations": [
        {
          "style_name": "Romance Engine",
          "justification": "This style perfectly aligns with the Contemporary Romance genre and provides the classic emotional journey that romance readers expect. The Meet→Fun→Fall Apart→Grand Gesture→Resolution structure creates natural emotional peaks and valleys that complement the specified tone balance between dark and light moments. The target age range (25-55) will appreciate this familiar yet satisfying structure, and it allows for the progressive tone shift mentioned in the project requirements, starting darker and moving toward lighter as the romance develops.",
          "audio_application": "The intimate acoustics and breathing patterns mentioned in the style description can be enhanced to match the project's tone specifications. Dark moments will feature minimal sound design, lower vocal registers, and dissonant musical elements during the 'Fall Apart' phase. Light moments will use warmer musical tones, dynamic vocal performances, and richer environmental sounds during the 'Meet' and 'Fun' phases. The 'Grand Gesture' and 'Resolution' phases will feature the most balanced audio design, with intimate acoustics highlighting emotional vulnerability. The narrator can provide context during transitions between these phases, using voice modulation to signal emotional shifts.",
          "structure_implications": "The Romance Engine structure suggests a clear 5-part progression that can be mapped across 10 episodes: Episodes 1-2 (Meet), 3-4 (Fun), 5-7 (Fall Apart), 8-9 (Grand Gesture), and 10 (Resolution). This structure supports the required tone progression, with early episodes weighted toward darkness (60/40 dark/light) during the initial meeting and complications, middle episodes achieving equilibrium (50/50) during the relationship fallout, and final episodes leaning toward light (40/60 dark/light) during the reconciliation. The narrator strategy works well with this structure, allowing for internal monologues during emotional transitions and providing context for the characters' choices.",
          "demo_script": "[Opening with minimal sound design, slightly dissonant piano music under]\nNARRATOR: Sarah stared at her phone, the unknown number glowing like an accusation. Another wrong number. The third this week. Depression had been her constant companion since Mark left, and now even her phone seemed determined to remind her of connections gone wrong.\n[SARAH's voice in a lower register, tired]\nSARAH: Hello?\n[Voice on the other end, warm and concerned]\nJAKE: Hi, is this Jessica? I'm sorry to bother you, but this is Jake from the clinic. Your test results came back.\n[Music shifts slightly, a hint of warmth]\nSARAH: (pause) You have the wrong number.\nJAKE: Oh, I'm so sorry. It's just... I was worried. Jessica hasn't been answering, and these results... well, they're important.\n[SARAH's voice softens slightly]\nSARAH: Is everything okay? You sound concerned.\nJAKE: (sighs) I probably shouldn't be discussing this with a stranger, but... she's been through a lot. I just want to make sure she's alright.\n[Music becomes warmer, more hopeful]\nSARAH: I understand that. Sometimes... sometimes the people we care about don't answer when we need them to.\nJAKE: I'm Jake, by the way. Wrong number, but... right concern, I guess?\nSARAH: (small laugh) I'm Sarah. Wrong number, right message?\n[Music swells with warmth, then fades slightly]\nNARRATOR: In that moment, Sarah didn't realize it, but the darkness that had been her constant companion had just found a crack of light. And Jake had no idea that a wrong number would lead him to exactly the right conversation."
        },
        {
          "style_name": "8-Sequence Structure",
          "justification": "This style offers a balanced approach to storytelling that works well for romance narratives while allowing for the complex emotional journey described in the tone requirements. The division into 8 mini-movements provides a natural rhythm for developing both the main romance plot and secondary storylines. For the target audience (25-55), this structure provides enough sophistication to maintain interest while still delivering the satisfying emotional beats expected in romance. The motif returns at each quarter-mark mentioned in the audio markers can be used to reinforce the tone progression from dark to light throughout the season.",
          "audio_application": "The motif returns at each quarter-mark can be designed to evolve with the tone progression. Early episodes will feature the motif in a minor key with sparse instrumentation, reflecting the 60/40 dark/light balance. As the story progresses, the motif will transform, incorporating more instruments and shifting to a major key during the middle episodes (50/50 balance). By the final episodes, the motif will be fully realized with rich instrumentation and harmonies, supporting the 40/60 dark/light ratio. The narrator can introduce and contextualize these motif variations, helping the audience track the emotional progression of the story.",
          "structure_implications": "The 8-Sequence Structure would work well with 10 episodes divided into 8 sequences, with some episodes containing multiple sequences. This allows for the gradual tone shift specified in the project requirements. The first two sequences (episodes 1-3) would establish characters and initial connection with darker undertones. Sequences 3-4 (episodes 4-5) would develop the relationship with balanced tones. Sequences 5-6 (episodes 6-7) would introduce major conflicts with darker moments. Sequences 7-8 (episodes 8-10) would resolve the conflict and bring the characters together with increasingly lighter tones. This structure supports the narrator strategy by providing clear transition points between sequences where the narrator can provide context and reflection.",
          "demo_script": "[Opening with minimal sound design, a simple piano motif plays in a minor key]\nNARRATOR: The message arrived at 2:17 AM, a time when only bad news or drunk texts intrude. For Sarah, it was both.\n[Phone notification sound, sparse]\nSARAH: (voice low, tired) Who texts at this hour?\n[Text message sound effect]\nNARRATOR: The message was simple, yet loaded with meaning: 'I know we agreed no contact, but I needed to hear your voice. Just once.'\n[SARAH sighs, the piano motif continues]\nSARAH: Wrong number, Mark. And even if it wasn't, I wouldn't answer.\n[Phone rings, a different tone than before]\nSARAH: (hesitant) Hello?\nJAKE: (voice warm, slightly concerned) Hi, sorry to call so late. Is this the bookstore?\n[SARAH's voice shifts slightly, less tired]\nSARAH: No, I think you have the wrong number.\nJAKE: Oh, I'm sorry. It's just... I'm looking for a specific book for my niece's birthday tomorrow, and I remembered this place stays open late.\n[The piano motif shifts slightly, a hint of major key]\nSARAH: I actually work at a bookstore. Which book are you looking for?\nJAKE: (surprised, pleased) Really? It's 'The Starlight Princess.' They said it might be hard to find.\n[Music softens, more intimate]\nSARAH: We have that. I'm closing up now, but... if you want to come by, I could wait.\nJAKE: That would be amazing. I'm Jake, by the way.\nSARAH: Sarah. And it's no trouble. Everyone deserves to find their story.\n[The piano motif returns, transformed with slightly richer harmonies]\nNARRATOR: Neither of them realized it yet, but this wrong number was the beginning of a story they hadn't known they were searching for."
        },
        {
          "style_name": "Hyperlink Structure",
          "justification": "This style offers a sophisticated approach that can appeal to the upper end of the target age range (25-55) by weaving multiple storylines that echo common themes of connection, miscommunication, and finding love in unexpected places. The parallel stories structure allows for exploration of different facets of romance and relationships, creating a richer narrative tapestry. This style also accommodates the specified tone progression well, as different storylines can carry different emotional weights, allowing for the overall balance to shift from dark to light across the season. The narrator strategy works particularly well with this structure, helping to connect the different threads and provide context for their thematic relationships.",
          "audio_application": "The distinct ambience per storyline mentioned in the audio markers can be designed to reflect the tone requirements. Primary storyline scenes between the main characters will follow the specified tone progression, starting with darker audio design and gradually incorporating lighter elements. Secondary storylines can have their own audio signatures that complement the main narrative's emotional journey. For example, a subplot involving a couple experiencing similar communication issues could mirror the main plot's audio evolution but with different instrumentation. The narrator can provide transitions between storylines, using voice modulation to signal shifts in perspective and emotional tone.",
          "structure_implications": "The Hyperlink Structure would work well with 10 episodes featuring 3-4 interconnected storylines that explore themes of mistaken identity, miscommunication, and unexpected connections. The main romance plot would follow the wrong number premise, while secondary plots might include a coworker's online dating misadventures, a friend's long-distance relationship challenges, and a family member's reconciliation with an estranged partner. These storylines would intersect at key moments, with the tone evolving collectively from darker to lighter across the season. Episodes 1-3 would establish all storylines with darker undertones, episodes 4-6 would develop them with balanced tones, and episodes 7-10 would resolve them with increasingly lighter moments, allowing for the specified tone progression.",
          "demo_script": "[Opening with minimal sound design, ambient city sounds]\nNARRATOR: In a city of eight million people, connections are made and broken every day. Sometimes by choice, sometimes by chance, and sometimes... by wrong numbers.\n[Phone notification sound, sparse]\nSARAH: (voice low, tired) Another wrong number. Fourth this week.\n[Scene shifts, different acoustic environment - coffee shop]\nNARRATOR: Meanwhile, across town, Emma scrolled through dating profiles, her coffee growing cold.\nEMMA: (sighs) Why does everyone say they love long walks on the beach? We live in a landlocked state.\n[Scene shifts again, different acoustic environment - office]\nNARRATOR: And in a downtown office, Michael stared at his phone, debating whether to call his sister after three years of silence.\nMICHAEL: (voice tight) Just because we had a fight doesn't mean I stopped caring.\n[Scene returns to SARAH's apartment, phone rings]\nSARAH: Hello?\nJAKE: (voice warm, slightly nervous) Hi, sorry to bother you. Is this the pharmacy?\n[SARAH's voice shifts slightly, less tired]\nSARAH: No, wrong number again.\nJAKE: (pause) You sound like you've had a lot of those lately.\n[Music softens, more intimate]\nSARAH: (surprised) You could say that. It's like my phone has become a magnet for misplaced calls.\nJAKE: Well... maybe some of those wrong numbers are right messages. I'm Jake, by the way.\nSARAH: Sarah. And I'm not sure I follow your philosophy on misdials.\nJAKE: (chuckles) Maybe I could explain over coffee? Unless you think that would be another wrong number?\n[Music swells with warmth, then transitions to the other storylines]\nNARRATOR: Across town, Emma matched with someone who didn't mention beaches. Michael saved his sister's number. And Sarah found herself smiling at a stranger's voice. In a city of eight million, connections were being forged, one conversation at a time."
        }
      ],
      "season_skeleton": {
        "macro_structure": {
          "act_1": "Episodes 1-2",
          "act_2": "Episodes 3-4",
          "act_3": "Episodes 5-7",
          "act_4": "Episodes 8-10"
        },
        "episode_grid": [
          {
            "episode_number": 1,
            "primary_function": "Setup",
            "energy_level": 6,
            "subplot_focus": "Character Introduction",
            "cliffhanger_type": "Intrigue"
          },
          {
            "episode_number": 2,
            "primary_function": "Development",
            "energy_level": 7,
            "subplot_focus": "Initial Connection",
            "cliffhanger_type": "Decision"
          },
          {
            "episode_number": 3,
            "primary_function": "Rising Action",
            "energy_level": 8,
            "subplot_focus": "Growing Attraction",
            "cliffhanger_type": "Revelation"
          },
          {
            "episode_number": 4,
            "primary_function": "Rising Action",
            "energy_level": 9,
            "subplot_focus": "Deepening Relationship",
            "cliffhanger_type": "Complication"
          },
          {
            "episode_number": 5,
            "primary_function": "Climax Setup",
            "energy_level": 7,
            "subplot_focus": "External Conflicts",
            "cliffhanger_type": "Confrontation"
          },
          {
            "episode_number": 6,
            "primary_function": "Climax",
            "energy_level": 10,
            "subplot_focus": "Relationship Crisis",
            "cliffhanger_type": "Emotional Break"
          },
          {
            "episode_number": 7,
            "primary_function": "Falling Action",
            "energy_level": 8,
            "subplot_focus": "Separation & Reflection",
            "cliffhanger_type": "Realization"
          },
          {
            "episode_number": 8,
            "primary_function": "Resolution Setup",
            "energy_level": 7,
            "subplot_focus": "Grand Gesture",
            "cliffhanger_type": "Hope"
          },
          {
            "episode_number": 9,
            "primary_function": "Resolution",
            "energy_level": 6,
            "subplot_focus": "Reconciliation",
            "cliffhanger_type": "New Beginning"
          },
          {
            "episode_number": 10,
            "primary_function": "Denouement",
            "energy_level": 5,
            "subplot_focus": "Future Together",
            "cliffhanger_type": "Closure"
          }
        ]
      },
      "rhythm_mapping": {
        "tension_peaks": [
          4,
          6,
          8
        ],
        "breathing_room": [
          3,
          7,
          10
        ],
        "format_breaks": [
          5,
          9
        ],
        "revelation_cascade": [
          2,
          4,
          6,
          8
        ]
      }
    },
    "readable_summary": "======================================================================\nSTATION 5: SEASON ARCHITECT\n======================================================================\n\nWorking Title: Wrong Number, Right Message\nPrimary Genre: Contemporary Romance\nTarget Age: 25-55\nEpisode Count: 8-12 episodes\nEpisode Length: 35-45 min each\nNarrator Strategy: With Narrator\n\n----------------------------------------------------------------------\nSTYLE RECOMMENDATIONS\n----------------------------------------------------------------------\n\n1. Romance Engine\n   Justification: This style perfectly aligns with the Contemporary Romance genre and provides the classic emotional journey that romance readers expect. The Meet→Fun→Fall Apart→Grand Gesture→Resolution structure creates natural emotional peaks and valleys that complement the specified tone balance between dark and light moments. The target age range (25-55) will appreciate this familiar yet satisfying structure, and it allows for the progressive tone shift mentioned in the project requirements, starting darker and moving toward lighter as the romance develops.\n   Audio Application: The intimate acoustics and breathing patterns mentioned in the style description can be enhanced to match the project's tone specifications. Dark moments will feature minimal sound design, lower vocal registers, and dissonant musical elements during the 'Fall Apart' phase. Light moments will use warmer musical tones, dynamic vocal performances, and richer environmental sounds during the 'Meet' and 'Fun' phases. The 'Grand Gesture' and 'Resolution' phases will feature the most balanced audio design, with intimate acoustics highlighting emotional vulnerability. The narrator can provide context during transitions between these phases, using voice modulation to signal emotional shifts.\n   Structure Implications: The Romance Engine structure suggests a clear 5-part progression that can be mapped across 10 episodes: Episodes 1-2 (Meet), 3-4 (Fun), 5-7 (Fall Apart), 8-9 (Grand Gesture), and 10 (Resolution). This structure supports the required tone progression, with early episodes weighted toward darkness (60/40 dark/light) during the initial meeting and complications, middle episodes achieving equilibrium (50/50) during the relationship fallout, and final episodes leaning toward light (40/60 dark/light) during the reconciliation. The narrator strategy works well with this structure, allowing for internal monologues during emotional transitions and providing context for the characters' choices.\n\n2. 8-Sequence Structure\n   Justification: This style offers a balanced approach to storytelling that works well for romance narratives while allowing for the complex emotional journey described in the tone requirements. The division into 8 mini-movements provides a natural rhythm for developing both the main romance plot and secondary storylines. For the target audience (25-55), this structure provides enough sophistication to maintain interest while still delivering the satisfying emotional beats expected in romance. The motif returns at each quarter-mark mentioned in the audio markers can be used to reinforce the tone progression from dark to light throughout the season.\n   Audio Application: The motif returns at each quarter-mark can be designed to evolve with the tone progression. Early episodes will feature the motif in a minor key with sparse instrumentation, reflecting the 60/40 dark/light balance. As the story progresses, the motif will transform, incorporating more instruments and shifting to a major key during the middle episodes (50/50 balance). By the final episodes, the motif will be fully realized with rich instrumentation and harmonies, supporting the 40/60 dark/light ratio. The narrator can introduce and contextualize these motif variations, helping the audience track the emotional progression of the story.\n   Structure Implications: The 8-Sequence Structure would work well with 10 episodes divided into 8 sequences, with some episodes containing multiple sequences. This allows for the gradual tone shift specified in the project requirements. The first two sequences (episodes 1-3) would establish characters and initial connection with darker undertones. Sequences 3-4 (episodes 4-5) would develop the relationship with balanced tones. Sequences 5-6 (episodes 6-7) would introduce major conflicts with darker moments. Sequences 7-8 (episodes 8-10) would resolve the conflict and bring the characters together with increasingly lighter tones. This structure supports the narrator strategy by providing clear transition points between sequences where the narrator can provide context and reflection.\n\n3. Hyperlink Structure\n   Justification: This style offers a sophisticated approach that can appeal to the upper end of the target age range (25-55) by weaving multiple storylines that echo common themes of connection, miscommunication, and finding love in unexpected places. The parallel stories structure allows for exploration of different facets of romance and relationships, creating a richer narrative tapestry. This style also accommodates the specified tone progression well, as different storylines can carry different emotional weights, allowing for the overall balance to shift from dark to light across the season. The narrator strategy works particularly well with this structure, helping to connect the different threads and provide context for their thematic relationships.\n   Audio Application: The distinct ambience per storyline mentioned in the audio markers can be designed to reflect the tone requirements. Primary storyline scenes between the main characters will follow the specified tone progression, starting with darker audio design and gradually incorporating lighter elements. Secondary storylines can have their own audio signatures that complement the main narrative's emotional journey. For example, a subplot involving a couple experiencing similar communication issues could mirror the main plot's audio evolution but with different instrumentation. The narrator can provide transitions between storylines, using voice modulation to signal shifts in perspective and emotional tone.\n   Structure Implications: The Hyperlink Structure would work well with 10 episodes featuring 3-4 interconnected storylines that explore themes of mistaken identity, miscommunication, and unexpected connections. The main romance plot would follow the wrong number premise, while secondary plots might include a coworker's online dating misadventures, a friend's long-distance relationship challenges, and a family member's reconciliation with an estranged partner. These storylines would intersect at key moments, with the tone evolving collectively from darker to lighter across the season. Episodes 1-3 would establish all storylines with darker undertones, episodes 4-6 would develop them with balanced tones, and episodes 7-10 would resolve them with increasingly lighter moments, allowing for the specified tone progression.\n\n----------------------------------------------------------------------\nSEASON SKELETON\n----------------------------------------------------------------------\n\nMACRO STRUCTURE:\n  act_1: Episodes 1-2\n  act_2: Episodes 3-4\n  act_3: Episodes 5-7\n  act_4: Episodes 8-10\n\nEPISODE GRID:\n  Episode 1: Setup (Energy: 6, Subplot: Character Introduction, Cliffhanger: Intrigue)\n  Episode 2: Development (Energy: 7, Subplot: Initial Connection, Cliffhanger: Decision)\n  Episode 3: Rising Action (Energy: 8, Subplot: Growing Attraction, Cliffhanger: Revelation)\n  Episode 4: Rising Action (Energy: 9, Subplot: Deepening Relationship, Cliffhanger: Complication)\n  Episode 5: Climax Setup (Energy: 7, Subplot: External Conflicts, Cliffhanger: Confrontation)\n  Episode 6: Climax (Energy: 10, Subplot: Relationship Crisis, Cliffhanger: Emotional Break)\n  Episode 7: Falling Action (Energy: 8, Subplot: Separation & Reflection, Cliffhanger: Realization)\n  Episode 8: Resolution Setup (Energy: 7, Subplot: Grand Gesture, Cliffhanger: Hope)\n  Episode 9: Resolution (Energy: 6, Subplot: Reconciliation, Cliffhanger: New Beginning)\n  Episode 10: Denouement (Energy: 5, Subplot: Future Together, Cliffhanger: Closure)\n\n----------------------------------------------------------------------\nRHYTHM MAPPING\n----------------------------------------------------------------------\n\nTension Peaks: Episodes 4, 6, 8\nBreathing Room: Episodes 3, 7, 10\nFormat Breaks: Episodes 5, 9\nRevelation Cascade: Episodes 2, 4, 6, 8\n\n======================================================================\nEND OF SEASON ARCHITECTURE\n======================================================================"
  }
}